{
  "date": "2025-06-21",
  "name": "Weekly Gems Report \u2014 2025-06-21",
  "repos": [
    {
      "full_name": "menloresearch/jan",
      "name": "jan",
      "owner": "menloresearch",
      "html_url": "https://github.com/menloresearch/jan",
      "description": "Jan is an open source alternative to ChatGPT that runs 100% offline on your computer",
      "stars": 32628,
      "forks": 1905,
      "language": "TypeScript",
      "trending_stars": 0,
      "trending_timespan": "weekly",
      "trending_score": 0.0,
      "source": "github_trending",
      "score": 4.0,
      "score_details": {
        "commit_surge": 3,
        "star_velocity": 0,
        "team_traction": 0,
        "dev_ecosystem_fit": 1,
        "signals": [
          "133 commits in last 14 days (20 feature commits)",
          "typescript language"
        ],
        "metrics": {
          "stars": 32628,
          "stars_gained_14d": 677,
          "forks": 1905,
          "forks_gained_14d": 39,
          "commits_14d": 133,
          "contributors_30d": 10,
          "avg_issue_resolution_days": 0.45
        }
      }
    }
  ],
  "threshold": 0
}