{
  "date": "2025-06-13",
  "name": "Weekly Gems Report \u2014 2025-06-13",
  "repos": [
    {
      "full_name": "tensorzero/tensorzero",
      "name": "tensorzero",
      "owner": "tensorzero",
      "html_url": "https://github.com/tensorzero/tensorzero",
      "description": "TensorZero creates a feedback loop for optimizing LLM applications \u2014 turning production data into smarter, faster, and cheaper models.",
      "stars": 6833,
      "forks": 411,
      "language": "Rust",
      "trending_stars": 0,
      "trending_timespan": "weekly",
      "trending_score": 0.0,
      "source": "github_trending",
      "score": 4,
      "score_details": {
        "commit_surge": 3,
        "star_velocity": 0,
        "team_traction": 0,
        "dev_ecosystem_fit": 1,
        "signals": [
          "72 commits in last 14 days (26 feature commits)",
          "rust language"
        ]
      }
    },
    {
      "full_name": "frdel/agent-zero",
      "name": "agent-zero",
      "owner": "frdel",
      "html_url": "https://github.com/frdel/agent-zero",
      "description": "Agent Zero AI framework",
      "stars": 9783,
      "forks": 1899,
      "language": "Python",
      "trending_stars": 0,
      "trending_timespan": "weekly",
      "trending_score": 0.0,
      "source": "github_trending",
      "score": 4,
      "score_details": {
        "commit_surge": 3,
        "star_velocity": 0,
        "team_traction": 0,
        "dev_ecosystem_fit": 1,
        "signals": [
          "51 commits in last 14 days (3 feature commits)",
          "python language"
        ]
      }
    },
    {
      "full_name": "netbirdio/netbird",
      "name": "netbird",
      "owner": "netbirdio",
      "html_url": "https://github.com/netbirdio/netbird",
      "description": "Connect your devices into a secure WireGuard\u00ae-based overlay network with SSO, MFA and granular access controls.",
      "stars": 15602,
      "forks": 729,
      "language": "Go",
      "trending_stars": 0,
      "trending_timespan": "weekly",
      "trending_score": 0.0,
      "source": "github_trending",
      "score": 3,
      "score_details": {
        "commit_surge": 3,
        "star_velocity": 0,
        "team_traction": 0,
        "dev_ecosystem_fit": 0,
        "signals": [
          "42 commits in last 14 days (14 feature commits)"
        ]
      }
    }
  ],
  "threshold": 0
}